12/16/2022 22:51:31,Martin Balcerowicz,@tran_scription@genomic.social,@tran_scription,"Royal Society University Research Fellow at the University of Dundee, interested in plant signalling & development 🌱☀️🌡️🧬; He/him",#PlantScience #Transcription #Translation #Temperature #Light

12/19/2022 6:21:38,Kaisa Kajala,kaisakajala@genomic.social,kaisakajala,Assistant prof interested in barrier cell types and their evolution.,

12/19/2022 7:34:21,Kenichi Tsuda,@kenichitsuda@mstdn.science,@Billion_of_Gods; @KenichiTsuda4,🇨🇳Professor@HZAU←🇩🇪GL@MPIPZ←🇺🇸PD@UofMinnesota←🇯🇵PhD@HokkaidoU.   Scientist who studies plant-microbe interactions.,Plant immunity; phytohormone; microbiota; evolution

12/19/2022 20:54:25,Isabel Monte,@Isabel_MonteG@ecoevo.social,@Isabel_MonteG,"Isabel studied Pharmacy and Biochemistry at the University of Salamanca (Spain) and did her Master’s in Biotechnology at the University Autonoma de Madrid (Spain). In 2011 she joined Prof. Roberto Solano’s lab (CNB-CSIC, Madrid) for her master thesis, PhD, and a short postdoc, where she investigated the evolution of jasmonate biosynthesis and signaling in land plants. In 2013, she started to work with her favorite plant, the liverwort Marchantia polymorpha, through a collaboration with Prof. Takayuki Kohchi (University of Kyoto, Japan). In 2019 she moved to Prof. Cyril Zipfel’s lab (University of Zürich, Switzerland) as a postdoc to study plant immunity in M. polymorpha. Since 2022, she is Junior Group Leader at the ZMBP (University of Tübingen, Germany).",#marchantia #jasmonates #evodevo #evompmi #plantscijobs

12/20/2022 13:13:15,Liz Haswell,@ehaswell@mstdn.social,@ehaswell,Studying plant mechanotransduction at WUSTL | Co-host of Taproot Podcast | Deputy Editor Science Advances | Plant Advisor at Arcadia Science,#plantbiology #scicomm #sciculture

12/23/2022 1:02:11,Saima Shahid,@psaima@genomic.social,@psaima,"Assistant Professor, Oklahoma State University",#SmallRNA #Transposons #ParasiticPlants #InterspeciesRNAi

12/23/2022 12:26:08,Alan Schulman,@alanhschulman@genomic.social,@alanhschulman,"The Schulman group applies genetics, genomics and physiology to understand the role of retrotransposons in genome dynamics and to pursue the basis of drought resilience and quality traits in barley, faba bean, and oat.",#foodsecurity #genomics #fabaceae #barley #retrotransposon

12/25/2022 14:05:31,Pat Heslop-Harrison,@Heslopharrison@scicomm.xyz,@pathh1,"Professor in agricultural genetics, biodiversity, genomics & chromosome evolution at University of Leicester UK and South China Botanical Garden","genomics, food security, chromosomes, evolution, science"

1/26/2023 17:53:01,Josep Gesti,@josepgesti@mastodont.cat,@josepgesti,I am a botanist and I do research on the flora of the NE of the Iberian Peninsula (SW Europe),#flora #plantscience #botany

2/22/2023 22:17:53,in silico Plants,@insilicoPlants@botany.social,@insilicoplants,in silico Plants is an open-access journal dealing with all aspects of computational plant science.,#model #openaccess #fspm #plantscience

3/1/2023 18:05:11,Takiko I,170182,,Undergraduate student ,

3/1/2023 18:05:16,Takiko I,170182,,Undergraduate student ,

3/1/2023 18:05:21,Takiko I,170182,,Undergraduate student ,

4/4/2023 13:56:52,The Global Plant Council ,@globalplantGPC@mastodon.social ,@globalplantGPC,Global coalition of plant/crop science societies seeking to develop plant science. ,#plantscience #plants #scicomm #agriculture 

4/20/2023 20:57:16,Ivan Radin,@radinbio@mstdn.science,@radinbio,,#micrsopyimages #moss #plants

4/23/2023 12:04:36,Cornelius Traas ,@theapplefarmer@mastodon.ie,@theapplefarmer,"I run a fruit farm, and lecture in plant science and horticulture in University of Limerick",#fruit #horticulture #apples #plants #ireland

11/30/2022 9:55:01,Susannah Lydon,@susieoftraken@mastodon.social,@susieoftraken,"Assistant Professor in Plant Science at the University of Nottingham - I teach about plants, rocks and scicomm, and explain the amazing things the plant fossil record can tell us to anyone who will listen.",#Palaeobotany #Paleobotany #Scicomm #Mesozoic #Botany