11/19/2022 15:26:22,Claudia Bonfio,@ClaudiaBonfio@mstdn.science,@ClaudiaBonfio,"Junior Group Leader at ISIS-Strasbourg (FR), former MSCA and 1851 Research Fellow in Cambridge (UK), exploring life's origins one cell at a time.",#NewPI #prebioticchemistry #originsoflife ,https://mstdn.science/@ClaudiaBonfio

11/19/2022 16:20:17,Marta Hatzell,@MartaHatzell@mstdn.science,@MartaHatzell,"Associate Professor, MEGeorgiaTech & GTChBE, Electrochemist, Decarbonize Catalysis and Separations ",#echem #energy #catalysis,https://mstdn.science/@MartaHatzell

11/19/2022 16:56:28,MJPEREZPEREZ,@MJPEREZPEREZ,@MJPEREZPER,,,??

11/19/2022 16:57:38,Jeff Gustafson,@gustafsongroup@mstdn.science,@GustafsonLab,Chemistry Professor at San Diego State ,,https://mstdn.science/@gustafsongroup

11/19/2022 17:16:44,Manila Ozhukil Valappil,@manilaov@mastodon.social,@Manilaov,"A postdoctoral fellow working on Materials Electrochemistry at Dept. of Chemistry, University of Waterloo.",#sciencetwitter #womeninSTEM #supportourscience,https://mastodon.social/@manilaov

11/19/2022 17:42:12,Stephan Hammer,@Stephan_Hammer@mstdn.science,@Stephan_Hammer,"Jun.-Prof. in the field of biocatalysis, organic synthesis, enzyme engineering, directed evolution",#Chemistry #directedevolution #biocatalysis #catalysis,https://mstdn.science/@Stephan_Hammer

11/19/2022 17:45:18,Colin Tice,@colin_tice@mastodon.social,@Cornt00th,Medicinal Chemist,,https://mastodon.social/@colin_tice

11/19/2022 18:17:43,Courtney M Quinn,@courtneymquinn@mastodon.world,@CourtneyM_Quinn,PhD student with Sustainable Hydrogen CDT. Northern Irish Farmer. Electrochemistry PhD student.,#chemistry #EDI #hydrogen #energy #phd,https://mastodon.world/@courtneymquinn

11/19/2022 19:25:15,Marc-Etienne Moret,@memoret@mstdn.science,@ME_Moret,Organometallic Chemist | Associate professor at Utrecht University,,https://mstdn.science/@memoret

11/19/2022 19:30:02,Damien Cornu,@damienc@piaille.fr,Damienaberlin,"Teacher and researcher in university of Lorraine, solid chemistry and reactivity at interfaces","Random, jokes, children and layered materials",https://piaille.fr/@damienc

11/19/2022 19:33:33,kzrt,@kzrt@mstdn.science,@kzrt,PhD phytochemist who now works in policy for industry,,https://mstdn.science/@kzrt

11/19/2022 20:22:26,Kathryn Allen,@kra2104@mastodon.world,@kra2104,"Chemist, former academic, proponent of LGBTQ 🏳️‍🌈 and women’s rights. ",,https://mastodon.world/@kra2104

11/19/2022 21:25:28,Johannes Gasteiger,@gasteigerjo@sigmoid.social,@gasteigerjo,"Research scientist at Google, working on graph neural networks and applications to chemistry",#ML #machinelearning #compchem,https://sigmoid.social/@gasteigerjo

11/19/2022 21:28:41,Sam Levine,@SRLevine@urbanists.social,,"Organic Chemist (Hi, Stoltz & Wood Labs!) and Chemical Biologist (Hi, Beatty Lab!) by training. Assistant Project Scientist at UCI (Hi, Paegel Lab!).",#chemistry #baking #biking #bikecommuting,https://urbanists.social/@SRLevine

11/19/2022 21:51:21,Victor Sans,@vss@fediscience.org,@vss31,"GenT Distinguished Researcher in advanced materials and sustainable processes. Interdisciplinary scientist and engineer with interests in sustainability, replacement of fossil feedstocks in energy and chemical industries, additive manufacturing, flow chemistry and digitalisation.","science, engineering, academia, sustainability",https://fediscience.org/@vss

11/19/2022 22:36:32,Marwin Segler,@marwinsegler@mastodon.social,@marwinsegler,Group Lead at Microsoft Research; ML for Chemistry ,#compchem #medchem #synthesis #chemoinformatics,https://mastodon.social/@marwinsegler

11/19/2022 23:11:44,Nikita Harvey,@nickynak3@mastodon.lol,@nickynak3,NMR Technician and PhD student at National Phenome Centre (Imperial College London) working in metabolomics,"#NMRchat, #metabolomics, #LGBTQInSTEM, MinoritiesInSTEM",https://mastodon.lol/@nickynak3

11/19/2022 23:30:41,Steph Gallant,@ChemGallant@mstdn.social,@ChemGallant,Chemistry Postdoc at the University of Montreal,#SERS #nanoparticles #plasmonics #SciArt #SciComm ,https://mstdn.social/@ChemGallant

11/19/2022 23:31:44,Clyde Davies ,@deadlyvices@toot.wales,@deadlyvices,"PhD Physical Chemistry, 1990. Have worked in a variety of Informatics roles since. Now run the Chem4Word project in my spare time.  ",#chem4word #cheminformatics #opensci,https://toot.wales/@deadlyvices

11/20/2022 0:21:22,Nicole Rijs,@njrijs@aus.social,@njrijs,"Still Not Sure Which Type of Chemist I Am @ UNSW Science, Sydney, Australia. Gas phase structural chemistry and reaction mechanisms. ",#chemistry #ozchem #massspec #womeninstem      #womeninscience,https://aus.social/@njrijs

11/20/2022 1:18:11,Marion Emmert,@emmertlab@mstdn.science,@emmertlab,,,https://mstdn.science/@emmertlab

11/20/2022 1:53:51,Emilio Gallicchio,@egallicchio@mastodon.social,@GallicchioEmi,"Theoretical/Computational Chemist, Biophysicist at Brooklyn College.",#chemistry #compchem #alchemistry #science #drugdiscovery #biomolecules,https://mastodon.social/@egallicchio

11/20/2022 2:39:08,Matthew Maddess,@MadMatt@mstdn.science,@matthewmaddess,Process Chemist at MRK,#chemtwitter,https://mstdn.science/@MadMatt

11/20/2022 4:54:43,Ruben Sousa,@luna@mstdn.science,@porchyougeese,1st year PhD Chemistry at Clemson University with an interest in bioinorganic chemistry and chemical biology,,https://mstdn.science/@luna

11/20/2022 5:19:39,Elisa Tomat,@elisatomat@mas.to,@elisatomat,"Scientist, Expat, Prof of Chemistry UArizona","#science, #womeninSTEM, #expatlife, #academia",https://mas.to/@elisatomat

11/20/2022 5:25:36,Nir Goldman,@nir_goldman@mastodon.social,@nir_goldman,"I’m a computational chemist at LLNL. I work on simulations of condensed matter under reactive conditions. I like to post about publications and science news mostly, and a bit about running and crossword puzzles as well. ",#compchem ,https://mastodon.social/@nir_goldman

11/20/2022 5:58:59,Alejandro Forigua,@aforiguac@mstdn.ca,@AForiguaC,I’m a PhD candidate at University of Victoria working on microfluidics and bioanalytical chemistry ,#Chemistry #Microfluidics #LatinXChem #LatinXinChE #Biophysics,https://mstdn.ca/@aforiguac

11/20/2022 6:26:31,Mathias Christmann,@christmanngroup@mstdn.science,@christmanngroup,Chemist @FU_Berlin. Works on #NaturalProducts & #Catalysis. Likes Tool and (occasionally) dive bars. Curator of #AwesomeChemistryPlaylist,#chemistry #naturalproducts #totalsynthesis #organocatalysis #berlin,https://mstdn.science/@christmanngroup

11/20/2022 7:11:43,Piia Bartos,@piiabartos@mstdn.science,@PiiaBartos,"I am a new PI in the field of molecular modeling of proteins, RNA and other molecules. My background is in drug and enzyme design.",#compchem #newPI #simulations,https://mstdn.science/@piiabartos

11/20/2022 7:34:42,Sean McKenna ,@seanmckenna@mstdn.science,@SeanMcK27,PhD candidate in chemical biology at Trinity College Dublin ,#research #chembio #medchem,https://mstdn.science/@seanmckenna

11/20/2022 8:34:20,Robin Corey,@robincorey@mstdn.science,@RobinCorey1,"Postdoc in Sansom & Stansfeld lab at University of Oxford, looking at membrane proteins and protein-lipid interactions using molecular dynamics",#MembraneProteins #MolecularDynamics #CompChem #Lipids,https://mstdn.science/@robincorey

11/20/2022 8:55:24,Magnus Palmblad,@magnuspalmblad@fediscience.org,@MagnusPalmblad,Into mass spectrometry and (bio/chem)informatics,#TeamMassSpec #proteomics #OpenScience,https://fediscience.org/@magnuspalmblad

11/20/2022 10:47:25,Didier Villers,@linusable@mastodon.social,@linusable,"Professor @UMONS belgian university. Physical-chemistry, pre-service chemistry teacher education, programming and numerical methods for science and chemists. Promoting opensource. Soon retired (2023). Hobbies: gardening, genealogy, cartography (openstreetmap) ",#Chemistry #Education #OpenSource #Python,https://mastodon.social/@linusable

11/20/2022 11:32:18,DiMoCAT group,@dimocat_iqcc@mstdn.science,@dimocat_iqcc,The Design and Modelling of Transition Metal Catalyzed Reactions (DiMoCat) group is an interdisciplinary group of research of the Institute of Computational Chemistry and Catalysis (IQCC) of the University of Girona.,#computationalchemistry #catalysis #organometallic #reactionmechanisms,https://mstdn.science/@dimocat_iqcc

11/20/2022 11:42:17,Kevin Lam,@kevin@mastodon.be,@KLChemistry,Synthesis electrochemist! ,#Chemistry #OrganoEchem #ZapZap #Electrochemistry,https://mastodon.be/@kevin

11/20/2022 12:09:47,Craig Day,@craigday@mstdn.science,@thecraigday,Postdoc (Troels Skrydstrup) at Aarhus University,#Chemistry #Organometallics #First-Row #Mechanism,https://mstdn.science/@craigday

11/20/2022 12:59:09,Manasi R Mulay,@manasi_scicomm@techhub.social,@manasirmulay,PhD student at University of Sheffield,"compchem, battchat, realtimechem, womeninstem, phdchat",https://techhub.social/@manasi_scicomm

11/20/2022 13:51:15,Jessica Andreani,@jessica_compbio@mstdn.science,@jessica_compbio,"Researcher in computational biology. Protein-protein & protein-RNA interactions, structure & evolution. Also mum.",,https://mstdn.science/@jessica_compbio

11/20/2022 14:19:03,Juliane Nguyen,@JulieNguyenLab@mstdn.science,@JulieNguyenLab,Professor at UNC at Chapel Hill,#Science #DrugDelivery #BiomedicalEngineering #Pharmacoengineering,https://mstdn.science/@JulieNguyenLab

11/20/2022 14:36:01,Ermal Ismalaj,@ErmalI@masto.ai,@ErmalIsmalaj,Research associate at CICbiomaGUNE. Interested in organofluorine chemistry and biomedical imaging. ,#organogfluorine #biomedicalimaging #PETimaging #fluorescence,https://masto.ai/@ErmalI

11/20/2022 14:55:01,Karn Parmar,@karnparmar@mstdn.science,@karnjitparmar,Synthetic organic chemists using machine learning techniques!,chemistry AI total synthesis materials,https://mstdn.science/@karnparmar

11/20/2022 15:01:14,Nick Boaz,@NickBoaz@libretooth.gr,Used to Be NickBoaz03 but I have deleted by twitter account,"Husband, Dad, Organic Chemistry Professor at North Central College, and Slow Runner","ChemEd, Chemistry, Compchem, Organic, Synthesis",https://libretooth.gr/@NickBoaz

11/20/2022 15:36:24,Ryan Potts,@ryanpotts@mstdn.science,@pottslab,,,https://mstdn.science/@ryanpotts

11/20/2022 16:51:12,Gabriel Sigmund,@GabrielS@mstdn.science ,@PyC_Gabriel,"environmental science, technology and chemistry researcher working mainly on organic contaminant mobility and sorption, carbonaceous sorbents and pyrogenic carbon from fires",#environment #contaminant #pollution ,https://mstdn.science/@GabrielS

11/20/2022 17:21:18,Patrick van der Wel,@p_vanderwel@mastodon.social,@p_vanderwel,"Biochemist & solid-state NMR spectroscopist at the Univ. Groningen - research and teaching on molecular structure & dynamics, amyloids, Huntington disease, membrane biophysics, (bio)materials",#nmrchat #biophysics #amyloid #polyQ,https://mastodon.social/@p_vanderwel

11/20/2022 17:33:35,Frédéric Lamaty,@FredLamaty@maston.world,@FredLamaty,"Senior Scientist @CNRS in Montpellier (France), Green Organic chemist ",#greenchem #mechanochemistry #drugdiscovery #peptide #catalysis,https://maston.world/@FredLamaty

11/20/2022 20:11:06,Joseph P.,@tonic@scicomm.xyz,@josephpollack,producing a compound used in biofabrication and biomanufacturing ,#bio #biomanfacturing #biofabrication #med #metabolism,https://scicomm.xyz/@tonic

11/20/2022 20:25:30,Eric Stach,@eric_stach@mstdn.social,@eric_stach,"Professor at Penn in MSE. Director of Laboratory for Research on the Structure of Matter, and NSF MRSEC. Co-founder Hummingbird Scientific. Personal page, opinions my own.",,https://mstdn.social/@eric_stach

11/20/2022 20:45:36,Rebecca Willits,@Rwillits@mstdn.science,@willitslab,,,https://mstdn.science/@Rwillits

11/20/2022 20:56:46,Matthew Macariou,@ChemistMatthew@Mastodon.world,@ChemistMatthew,Podcaster host : Chemistry Made Simple podcast. Neurodivergent (autism and ADHD),#AlevelChemistry #ChemistryMadeSimple #ActuallyAutistic #ADHD,https://Mastodon.world/@ChemistMatthew

11/20/2022 21:07:53,Brett Garabedian,@Garabedian@mastodon.science,@BrettGarabedian,PhD Candidate with @jcpjim @scrippsresearch - Building immune therapies aimed at cancer’s sweet spot 🍭 #glycotime @Garabedian@mastadon.science,#SialicAcid #Glycotime #Bioorthogonal #ClickChemistry #TPD,https://mastodon.science/@Garabedian

11/20/2022 21:10:41,Miranda Lynch,@MirandaLynchPhD@fediscience.org,@gammagirllab (now inactive),I am a quantitative scientist working in structural biology and protein dynamics. ,#StructuralBiology #Crystallography #MathBio #ProteinScience #ComputationalChemistry,https://fediscience.org/@MirandaLynchPhD

11/20/2022 22:16:09,Melanie Rodriguez,@Mel_1090@mstdn.science,@Mel_1090,,"#Chemistry, #ChemicalBiology, #synthesis, #TPD",https://mstdn.science/@Mel_1090

11/21/2022 2:00:25,Natalia Labadie,@natilabadie@masto.ai,@natilabadie,PhD student in computational and synthetic organic chemistry at IQUIR CONICET. Teaching statistics at National University of Rosario.,#compchem #orgchem #datasci #academia,https://masto.ai/@natilabadie

11/21/2022 5:23:27,Karel Berka,@caco3@scholar.social,@caco3cz,"physical chemist and biochemist by training, structural bioinformatician and cheminformatician in Chemical data lab at Department of physical chemistry, Palacky University Olomouc. ","#elixir, #structuralbiology, #sciencepolicy",https://scholar.social/@caco3

11/21/2022 5:29:30,Pratyush Kumar Mishra ,@pkmishra@mstdn.science,pkmishra92,"Early career researcher at Seoul National University, exploring proximity reactions in live cell for various applications. ",,https://mstdn.science/@pkmishra

11/21/2022 5:56:39,Lily Wang,@lilyminium@mastodon.social,lilyminium,"Science lead at Open Force Field, core developer of MDAnalysis, and noodle connoisseur","#compchem, #opensource, #scitwitter",https://mastodon.social/@lilyminium

11/21/2022 6:11:14,Roland Dunbrack,@RolandDunbrack@mstdn.science,@RolandDunbrack,,#structuralbioinformatics #alphafold2 #lgbtq ,https://mstdn.science/@RolandDunbrack

11/21/2022 6:27:23,Girinath Pillai,@giribio@mas.to,@giribio,Lead Scientist at Sygnature Discovery. Drug discovery and computational chemistry ,#compchem #qsar #drugdiscovery #longevity #bioinformatics,https://mas.to/@giribio

11/21/2022 7:19:41,pschmidtke,@pschmidtke@masto.ai,@pschmidtke,"European, trapped in France, interested in structural bioinformatics and drug discovery","drugdiscovery, compchem, sbdd, molecularmodelling, ",https://masto.ai/@pschmidtke

11/21/2022 7:32:17,Longyu Li,@Longyu_Li@mastodon.social,@Longyu_Li88,"Professor at Polymer Science and Engineering in Sichuan University, BS@Nankai, PhD @UmassAmherst, Postdoc@Berkeley, and @Dartmouth. A Manchester United Fan.",#chemistry #science #polymer #supramolecular #porous,https://mastodon.social/@Longyu_Li

11/21/2022 8:51:09,Tim Craggs - Craggs Lab,@TimCraggs@mstdn.science,@craggs_lab,"Senior Lecturer in Biophysics; Founder and Director at Exciting Instruments @EI_Science; Single-molecule FRET instrumentation, methods and applications; Dynamic Structural Biology",#Biophysics #OpenScience #smFRET #FaithAndScience #Family ,https://mstdn.science/@TimCraggs

11/21/2022 9:43:15,Julien Lefranc,@lefrancju@mstdn.science,@LefrancJu,medicinal Chemist @ Merck KGaA,#drugdiscovery #MedChem,https://mstdn.science/@lefrancju

11/21/2022 9:52:39,Rob Jackson,@jacksonroba@fosstodon.org,@robajackson,Computational Solid State Chemist at Keele University,"#Chemistry, #SocialMedia, #Politics",https://fosstodon.org/@jacksonroba

11/21/2022 10:36:29,Jeet Chakraborty,@UtopianChemist@vmst.io,@UtopianChemist,"I am postdoc @COMOC, UGent working on redox-active porous materials for photo and electrocatalysis."," #Catalysis,  #Photochemistry, #Electrochemistry, #PorousMaterial, #CCU",https://vmst.io/@UtopianChemist

11/21/2022 12:05:10,Evelyn Hosner,@evelynho@sueden.social,@evelyn_ho_,Working at Thieme Chemistry,#organicsynthesis #womeninchemistry #thiemefamily #cheminar #organicchemistry,https://sueden.social/@evelynho

11/21/2022 12:39:21,Philippe Schwaller,@pschwllr@sigmoid.social,pschwllr,Tenure-Track Assistant Professor of Digital Chemistry at EPFL | Laboratory of Artificial Chemical Intelligence (LIAC) | NCCR_Catalysis | prev IBM Research | ML/AI-accelerated Chemistry,#compchem #ml4chem #chemtwitter,https://sigmoid.social/@pschwllr

11/21/2022 12:40:21,Fabien Ferrage,@fabferrage@fediscience.org,@fabferrage,"Senior scientist at CNRS, assoc. prof. at ENS -PSL, Paris, France",#NMRChat #ChemistsWhoCook,https://fediscience.org/@fabferrage

11/21/2022 12:59:34,Fiona Shortt de Hernandez,@fionashorttdehernandez@mstdn.social,@SOSChem,Senior Director @thiemechemistry PhD in organic synthesis and MBA. Founder @cheminclusion,#cheminclusion #chemistry #DEI #womeninchemistry #publishing #chemtwitter,https://mstdn.social/@fionashorttdehernandez

11/21/2022 13:44:22,Jim Wright,@jwrig002@mstdn.science,@jwrig002,Chemists turned safety pro,#chemsafety #biosafety #chemistry #cleanenergy #circulareconomy,https://mstdn.science/@jwrig002

11/21/2022 14:51:24,Kristen Kulinowski,@Kulinowski@mastodon.world,@kulinowski,"STPI Director. SciPol, nano, disasters etc. @AmerChemSociety Fellow. Frmr @chemsafetyboard member",#sciencepolicy,https://mastodon.world/@Kulinowski

11/21/2022 20:18:15,Andryj Borys,@AndryjBorys@mstdn.science,@AndryjBorys,Post-Doc in Main-Group and Organometallic Chemistry,#Chemistry #RealTimeChem #Nickel #Phosphorus #NMR,https://mstdn.science/@AndryjBorys

11/21/2022 21:50:40,Josh Kellogg,@naturalproductsci@sciencemastodon.com,@jkellogg916,"Assistant Professor at Penn State University, we look at natural product discovery for infectious diseases and develop some analytical chemistry/metabolomics tools along the way.",#naturalproducts #ethnobotany #metabolomics #massspectrometry #infectiousdisease,https://sciencemastodon.com/@naturalproductsci

11/22/2022 2:42:11,Sosthène Ung,@sostheneung@ohai.social,@SostheneUng,"Recent PhD Graduate from the CJ Li lab at McGill University, Montréal. I worked on developping novel phosphorylation reactions for the construction of carbon-phosphorus(V) bonds in a more sustainable way. Love SciComm",#Chemistry #Phosphorus #OrganicChemistry #Sustainability #SciComm,https://ohai.social/@sostheneung

11/22/2022 4:50:55,Mayuri Sadoine,@MayuriSadoine@mstdn.social,@MayuriSadoine,"Biophysics, sensors, microfluidics, microbes",,https://mstdn.social/@MayuriSadoine

11/22/2022 4:55:20,Jocelyne Bouzaid,@redruby17@mstdn.social,redruby17,"Scientist, communicator, educator. Fan of logic, born to be awesome, often described as weird but in a good way. My opinions are my own. Expect typos. She/her",#WomenInSTEM #leadership #cats #change,https://mstdn.social/@redruby17

11/22/2022 5:34:31,sara h mejias,@sarahmejias@mastodon.world,@sarahmejias3,,#science ,https://mastodon.world/@sarahmejias

11/22/2022 7:42:04,Michel Gravel,@michelgravel@mstdn.science,@michelgravel6,"Professor of chemistry at the University of Saskatchewan, Canada. Organic and computational chemistry.",#chemistry #aromaticity #organic #annulenes #NHC,https://mstdn.science/@michelgravel

11/22/2022 9:22:35,Simon Krause,@krauselab@qoto.org ,@SimonKrause39,Researcher working on dynamic crystals and materials - now with a lab account on mastodo,#Chemistry #openscience #MOFs #science,https://qoto.org/@krauselab 

11/22/2022 9:38:49,Kyle Pearce,@KyleGPearce@mstdn.science,@KyleGpearce,Main-Group Chemistry Research Associate - Hill Group - Bath University,#RealTimeChem #Chemistry #NMR #Phosphorus #Crystallography,https://mstdn.science/@KyleGPearce

11/22/2022 15:36:53,Volker Blum,@volkerblum@nerdculture.de,@aimsduke,"Computational materials scientist and computational chemist at Duke University, developer of electronic structure methods (FHI-aims), tries to use computation to understand semiconductors (inorganic, organic-inorganic), nanostructures, molecular properties, spectroscopies and more.",,https://nerdculture.de/@volkerblum

11/22/2022 17:25:58,Stijn De Baerdemacker ,@cortogantese@mastodon.social,@cortogantese,quantum chemist @unb | canada research chair | looking for excuses to do math | @Staedtler pigment liner 0.3mm,#theochem #compchem #quantum #sketch,https://mastodon.social/@cortogantese

11/22/2022 20:57:46,Matthew Leech,@MattTheChemist@mastodon.world,@MattTheChemist,Former organometallic and phosphorus chemist. Research Fellow in Electrosynthesis at University of Greenwich. Views my own. He/Him,#Chemistry #RealTimeChem #OrganoEChem #ChemiVerse,https://mastodon.world/@MattTheChemist

11/22/2022 21:47:44,Charles Machan,@drchawz@mastodon.online,@drchawz,,,https://mastodon.online/@drchawz

11/22/2022 22:37:11,Sam Daly,@samofmidworld@mastodonapp.uk,@samofmidworld,Chem PhD student @ TheLeeLab (Cambridge) | 3D super res and fluorophores,#microscopy #chemistry #biophysics #SMLM #activism,https://mastodonapp.uk/@samofmidworld

11/23/2022 3:56:36,Tehshik Yoon,@tehshikyoon@mstdn.social,@tehshikyoon,,,https://mstdn.social/@tehshikyoon

11/23/2022 9:31:24,Rienk Eelkema,@RienkEelkema@mstdn.science,@EelkemaLab,PI @ TU Delft | org chem | soft matter | responsive materials | radiation | chemical reaction networks,#chemicalreactionnetworks #gelsgelsgels #radiochemotherapy #sciencepolicy #outofequilibrium,https://mstdn.science/@RienkEelkema

11/23/2022 19:01:11,Ahmad R Kirmani,@AhmadRKirmani@mstdn.social,@AhmadRKirmani,Incoming Assistant Professor at the Rochester Institute of Technology (RIT) in chemistry and materials science. @Kirmani_Group will advance printed electronics for terrestrial and space applications.,#perovskites #solarcells #spacetech #printedelectronics ,https://mstdn.social/@AhmadRKirmani

11/23/2022 23:15:57,Andreas Goetz,@awgoetz@mastodon.online,@awgoetz,"I lead a research group in Data-Driven and High-Performance Computational Chemistry at the San Diego Supercomputer Center at the University of California, San Diego. I develop HPC and GPU-enabled multi-scale simulation methods in the Amber molecular simulations package and the QUICK quantum chemistry code. Born in Germany, lived in Italy and the Netherlands, settled in the US.",#compchem #hpc #MolecularDynamics #QuantumChemistry #MachineLearning ,https://mastodon.online/@awgoetz

11/24/2022 0:11:02,Jen Koviach-Côté,@JenKoviachCote@mstdn.science,@JenKoviachCote,Organic chemist at Bates College,#chemistry #chemed #realtimechemistry,https://mstdn.science/@JenKoviachCote

11/24/2022 6:28:15,Steven Kirk,@srk@mstdn.science,,"Computational Chemist, BEACON Research Group, Hunan Normal University, China. Interested in #ultrafast #electrondynamics, #chirality, chemical topology. Research website: https://www.beaconresearch.org/",#computationalchemistry #science #theoreticalchemistry #chemicalphysics,https://mstdn.science/@srk

11/25/2022 3:52:34,Stephan Scheeff (Chemistry Research),@organic_chemistry@mstdn.social,_org_chemistry,"Short excerpts about recent developments in the field of total synthesis, catalysis, organocatalysis, metathesis and organic chemistry in general. Currated by Stephan Scheeff (Post-Doc at CUHK, School of Pharmacy)",#OrganicChemistry #MedChem,https://mstdn.social/@organic_chemistry

11/25/2022 7:44:14,Guillaume Prestat,@PrestatG@mastodon.world,@PrestatG,Professor Organic Chemistry Université Paris Cité,,https://mastodon.world/@PrestatG

11/26/2022 7:33:18,Magnus Kjaergaard,@Proteinmagnus@mastodon.social,@Proteinmagnus,Protein biophysicist working on protein disorder and dynamics.,#biophysics #protein,https://mastodon.social/@Proteinmagnus

11/26/2022 14:43:23,AlexHenderson,@alexhenderson@fosstodon.org,@AlexHenderson00,"Manchester Univ. UK. Hyperspectral imaging using IR, mass spec, Raman, MALDI etc. Data analysis, data management, semantics. CLIRSPEC. SurfaceSpectra.",#infrared #tofsims #knowledgegraphs #chemometrics #mva,https://fosstodon.org/@alexhenderson

11/26/2022 16:18:19,Paul Dauenhauer,@pauldauenhauer@sciencemastodon.com,@pauldauenhauer,"Professor, MacArthur Fellow, Lakril Technologies, Sironix Renewables, Carba, ARC",#ChemTwitter ,https://sciencemastodon.com/@pauldauenhauer

11/28/2022 9:34:59,Christian,@scipython@mastodon.world,@scipython3,Former Spectroscopist and eternal Pythonista now working in Nuclear Fusion at the IAEA,#Python #Physics #Chemistry #Fusion,https://mastodon.world/@scipython

11/28/2022 14:03:38,Anat Milo,@anat@ioc.exchange,@anatmilo,Physical Organic Chemist ,#PhysOrg #ChemLab #Catalysis #Organocatalysis #MachineLearning,https://ioc.exchange/@anat

11/30/2022 20:07:15,Henrique C. S. Junior,@hcs@mathstodon.xyz,,Computational chemist from Rio de Janeiro. Working mostly with molecular magnetism and organic photochemistry.,#compchem #inorgchem #photochem,https://mathstodon.xyz/@hcs

12/1/2022 16:43:06,Raphael Berger,@rjf_berger@mathstodon.xyz,,"Docent for inorganic chemistry and adj. prof. for physical chemistry, dad, cycling afficionado",Science that is interesting and some fun,https://mathstodon.xyz/@rjf_berger

12/2/2022 20:34:18,Colin Rathbun,@rathbun@mstdn.science,,Assistant Professor at Dickinson College. Chemical biologist. Bioluminescent protein tool developer. Scrappy python coder.,#chembio #chemicalbiology #python,https://mstdn.science/@rathbun

12/3/2022 11:47:25,Thorn-Seshold Lab,@ThornSesholdLab@mstdn.science,@ThornSesholdLab,"LMU Munich, Chemical Biology",#chembio #orgsyn #photochem #chemicalbiology #chemicalprobes,https://mstdn.science/@ThornSesholdLab

12/5/2022 0:32:14,"Heather Price, PhD",@huprice@mastodon.social,@huprice,Chemistry professor at North Seattle College. My research focus is integrating climate justice and civic engagement into general and GOB chemistry and facilitating faculty to do the same across STEM and humanities curriculum. ,#ClimateJustice #ChemEd #ClimateAction #CivicEngagementInSTEM #SocialJusticeInSTEM,https://mastodon.social/@huprice

